Summary,Description,Issue Type,Priority,Status,Labels,Assignee,Reporter
"Projekt struktúra létrehozása","Alapvető projektfájlok és mappastruktúra létrehozása a frontend és backend számára","Task","High","To Do","Setup","novakakos87@gmail.com","novakakos87@gmail.com"
"Alapvető navigációs menü","Navigációs menü komponens létrehozása, linkek hozzáadása a főoldalhoz, portfólió oldalhoz, és kapcsolati oldalhoz","Task","High","To Do","Frontend","novakakos87@gmail.com","novakakos87@gmail.com"
"Főoldal hero szekció","A főoldal bevezető szövege és hívó gombok elhelyezése. A hívó gomb linkelése a portfólió szekcióhoz.","Task","Medium","To Do","Frontend","novakakos87@gmail.com","novakakos87@gmail.com"
"Főoldal linkek és gombok","Gombok és linkek stílusozása a főoldalon, hover effekt hozzáadása","Task","Medium","To Do","Frontend","novakakos87@gmail.com","novakakos87@gmail.com"
"Portfólió projektek megjelenítése","Portfólió oldal fejlesztése a projektek listázásával, minden projektnél kép, cím és leírás megjelenítése","Story","High","To Do","Frontend","novakakos87@gmail.com","novakakos87@gmail.com"
"Projektek részletező oldal","Dinamikus oldal létrehozása minden projekthez, ahol részletes információk és képek jelennek meg","Task","High","To Do","Frontend","novakakos87@gmail.com","novakakos87@gmail.com"
"Portfólió oldal linkek","Linkek létrehozása a projektek címére, amely átirányítja a felhasználót a részletező oldalra","Task","Medium","To Do","Frontend","novakakos87@gmail.com","novakakos87@gmail.com"
"Kapcsolat oldal form","Kapcsolat oldali űrlap kialakítása név, email és üzenet mezőkkel","Task","High","To Do","Frontend","novakakos87@gmail.com","novakakos87@gmail.com"
"Kapcsolat form validáció","Kapcsolati űrlap mezőinek validálása (például kötelező mezők ellenőrzése, email formátum)","Task","High","To Do","Frontend","novakakos87@gmail.com","novakakos87@gmail.com"
"Kapcsolat form backend integráció","Backend funkció létrehozása az űrlap adatainak fogadására és tárolására","Task","High","To Do","Backend","novakakos87@gmail.com","novakakos87@gmail.com"
"Kapcsolat form visszajelzés","Visszajelző üzenet megjelenítése sikeres beküldés esetén vagy hiba esetén (pl. hálózati hiba)","Task","Medium","To Do","Frontend","novakakos87@gmail.com","novakakos87@gmail.com"
"Backend API létrehozása","Backend API endpointok létrehozása az adatok (projektek, űrlap) kezelésére","Story","High","To Do","Backend","novakakos87@gmail.com","novakakos87@gmail.com"
"Projektek adatainak betöltése API-val","A projektek listájának dinamikus betöltése a backend API használatával","Task","High","To Do","Frontend,Backend","novakakos87@gmail.com","novakakos87@gmail.com"
"Egységtesztelés","Frontend és backend egységtesztek létrehozása a fontosabb funkciókhoz (pl. űrlap validáció)","Task","High","To Do","Testing","novakakos87@gmail.com","novakakos87@gmail.com"
"Kapcsolat form integrációs teszt","Integrációs teszt készítése a kapcsolat űrlap backend adatfeldolgozására","Task","Medium","To Do","Testing","novakakos87@gmail.com","novakakos87@gmail.com"
"Stílus és UI finomítás","Globális stílusok beállítása, színek, betűtípusok, és gombok megjelenésének végső finomítása","Task","Medium","To Do","Frontend","novakakos87@gmail.com","novakakos87@gmail.com"
"Reszponzív design beállítása","Weboldal reszponzív beállítása különböző eszközökre, pl. mobil, tablet és asztali nézet","Task","High","To Do","Frontend","novakakos87@gmail.com","novakakos87@gmail.com"
"SEO alapok hozzáadása","Meta címkék, leírások és kulcsszavak hozzáadása az oldalakhoz a jobb keresőoptimalizálás érdekében","Task","Low","To Do","SEO","novakakos87@gmail.com","novakakos87@gmail.com"
"Élesítés előtti tesztelés","Az oldal végső tesztelése, hibák javítása, élesítés előtti utolsó ellenőrzések","Task","High","To Do","Testing","novakakos87@gmail.com","novakakos87@gmail.com"
"Deployment pipeline beállítása","CI/CD pipeline beállítása, automatikus deployment a szerverre","Task","High","To Do","Deployment","novakakos87@gmail.com","novakakos87@gmail.com"
"Footer létrehozása","Footer szekció létrehozása, amely tartalmazza az elérhetőségeket és social media linkeket","Task","Medium","To Do","Frontend","novakakos87@gmail.com","novakakos87@gmail.com"
"Social media linkek hozzáadása","Social media ikonok elhelyezése és linkek hozzáadása (pl. LinkedIn, GitHub)","Task","Low","To Do","Frontend","novakakos87@gmail.com","novakakos87@gmail.com"
"Projektkártya animációk","Animációs effektusok hozzáadása a portfólió projektkártyák hover eseményeihez","Task","Medium","To Do","Frontend","novakakos87@gmail.com","novakakos87@gmail.com"
"Dark mode implementálása","Dark mode beállítása és kapcsoló gomb létrehozása a felhasználói felületen","Story","High","To Do","Frontend","novakakos87@gmail.com","novakakos87@gmail.com"
"Oldalsáv fejlesztése","Oldalsáv komponens létrehozása a könnyebb navigáció érdekében","Task","Medium","To Do","Frontend","novakakos87@gmail.com","novakakos87@gmail.com"
"Kapcsolat oldali reCAPTCHA integráció","Google reCAPTCHA hozzáadása a kapcsolat oldali űrlaphoz a spam védelem érdekében","Task","High","To Do","Frontend","novakakos87@gmail.com","novakakos87@gmail.com"
"Weboldal loading spinner","Loading spinner hozzáadása az oldal elején, amíg minden tartalom betöltődik","Task","Low","To Do","Frontend","novakakos87@gmail.com","novakakos87@gmail.com"
"Portfólió projektek filterezése","Filter opció hozzáadása a portfólió oldalhoz, kategóriák szerinti szűrés lehetőségével","Task","Medium","To Do","Frontend","novakakos87@gmail.com","novakakos87@gmail.com"
"Projektek címkézése","Minden projekt címkézése (pl. 'Frontend', 'Backend', 'Design') a könnyebb kereshetőség érdekében","Task","Low","To Do","Frontend","novakakos87@gmail.com","novakakos87@gmail.com"
"Felhasználói bejelentkezés","Alap felhasználói bejelentkezési funkció létrehozása a weboldalhoz","Story","High","To Do","Frontend,Backend","novakakos87@gmail.com","novakakos87@gmail.com"
"Felhasználói regisztráció","Felhasználói regisztrációs funkció és validáció kialakítása","Task","High","To Do","Frontend,Backend","novakakos87@gmail.com","novakakos87@gmail.com"
"Jelszó visszaállítás","Jelszó visszaállítás funkció létrehozása email küldéssel","Task","High","To Do","Backend","novakakos87@gmail.com","novakakos87@gmail.com"
"Oldal betöltési sebességének optimalizálása","Képek optimalizálása, kód minifikálása, cache beállítása a gyorsabb betöltésért","Task","High","To Do","Optimization","novakakos87@gmail.com","novakakos87@gmail.com"
"Sitemap generálása","Oldaltérkép generálása a weboldal URL-jeinek listázásához, keresőmotorok számára","Task","Medium","To Do","SEO","novakakos87@gmail.com","novakakos87@gmail.com"
"404 hiba oldal","404-es hibaoldal létrehozása, hogy barátságos üzenetet jelenítsen meg, ha az oldal nem található","Task","Low","To Do","Frontend","novakakos87@gmail.com","novakakos87@gmail.com"
"Adatvédelmi nyilatkozat oldal","Adatvédelmi nyilatkozat oldal létrehozása az adatvédelmi szabályoknak megfelelően","Task","High","To Do","Legal","novakakos87@gmail.com","novakakos87@gmail.com"

